{
  "$schema": "https://json-schema.org/draft/2020-12/schema",
  "$id": "https://github.com/Nyzeep/Orchestella-Studio/tools/accelerator-perf/schema/accelerator-perf-v2.json",
  "title": "accelerator-perf-v2",
  "description": "AX-07 cross-lane performance report with PVM-07 optional segment fields (preprocess/transport/payload-load/compile/link). Deterministic, path-free and identifier-free by construction; validate.py is the enforcing implementation. Segment fields are optional and must be null when not measured - never 0.",
  "type": "object",
  "additionalProperties": false,
  "required": [
    "schema",
    "build_id",
    "device_alias",
    "generated_at_utc",
    "protocol",
    "scenarios"
  ],
  "properties": {
    "schema": { "const": "accelerator-perf-v2" },
    "build_id": {
      "type": "string",
      "pattern": "^[A-Za-z0-9._-]{1,48}$",
      "description": "Stable build identifier (version suffix or CI run alias), never a path."
    },
    "device_alias": {
      "type": "string",
      "pattern": "^[A-Za-z0-9._-]{1,48}$",
      "description": "Stable bench alias. Never a serial, IMEI, Android ID, MAC or IPv4 address."
    },
    "generated_at_utc": {
      "type": "string",
      "pattern": "^\\d{4}-\\d{2}-\\d{2}T\\d{2}:\\d{2}:\\d{2}Z$"
    },
    "protocol": {
      "type": "object",
      "additionalProperties": false,
      "required": ["min_samples", "iqr_method", "speedup_threshold", "regression_permille"],
      "properties": {
        "min_samples": { "const": 10 },
        "iqr_method": { "const": "linear-interpolation-on-sorted-values" },
        "speedup_threshold": { "const": 1.5 },
        "regression_permille": { "const": 50 }
      }
    },
    "scenarios": {
      "type": "array",
      "minItems": 1,
      "items": { "$ref": "#/$defs/scenario" }
    }
  },
  "$defs": {
    "scenario": {
      "type": "object",
      "additionalProperties": false,
      "required": [
        "scenario",
        "mode",
        "n",
        "failures",
        "failure_codes",
        "insufficient_samples",
        "median_ms",
        "iqr_ms",
        "min_ms",
        "max_ms",
        "phases_ms",
        "offload_permille",
        "retries",
        "fallbacks",
        "peak_kb"
      ],
      "properties": {
        "scenario": {
          "enum": [
            "cold_start",
            "small_project",
            "medium_project_j1",
            "medium_project_j2",
            "medium_project_j4"
          ]
        },
        "mode": { "enum": ["QEMU_ONLY", "QEMU_PLUS_ACCEL"] },
        "n": { "type": "integer", "minimum": 0, "description": "Successful samples only." },
        "failures": { "type": "integer", "minimum": 0 },
        "failure_codes": {
          "type": "object",
          "description": "Fixed reason codes only; free-form text is a protocol violation.",
          "propertyNames": {
            "enum": [
              "NONE",
              "ACCEL_AVAILABLE",
              "ACCEL_UNAVAILABLE_NO_NON_PROTECTED",
              "ACCEL_IMAGE_MISSING",
              "ACCEL_VSOCK_UNAVAILABLE",
              "COMPILER_MISMATCH",
              "THERMAL_BUDGET",
              "ACCELERATOR_UNAVAILABLE",
              "LANE_LOST",
              "STOP_UNCONFIRMED",
              "DISTCC_FALLBACK",
              "TIMEOUT",
              "PAYLOAD_LOAD_FAILED",
              "ARGV_REJECTED",
              "JOB_TOO_LARGE",
              "JOB_TIMEOUT"
            ]
          },
          "additionalProperties": { "type": "integer", "minimum": 1 }
        },
        "insufficient_samples": { "type": "boolean" },
        "median_ms": { "type": ["number", "null"], "minimum": 0 },
        "iqr_ms": { "type": ["number", "null"], "minimum": 0 },
        "min_ms": { "type": ["integer", "null"], "minimum": 0 },
        "max_ms": { "type": ["integer", "null"], "minimum": 0 },
        "phases_ms": {
          "type": ["object", "null"],
          "additionalProperties": false,
          "required": ["preprocess", "transfer", "compile", "link"],
          "properties": {
            "preprocess": { "type": "number", "minimum": 0 },
            "transfer": { "type": "number", "minimum": 0 },
            "compile": { "type": "number", "minimum": 0 },
            "link": { "type": "number", "minimum": 0 }
          }
        },
        "preprocess_ms": {
          "type": ["number", "null"],
          "minimum": 0,
          "description": "Guest-local preprocessing (clang -E) segment median; null when not measured."
        },
        "transport_ms": {
          "type": ["number", "null"],
          "minimum": 0,
          "description": "AXP1 frame transport segment median, host-measured; null when not measured."
        },
        "transport_bytes": {
          "type": ["number", "null"],
          "minimum": 0,
          "description": "Bytes on the wire per job (post-deflate) segment median; null when not measured."
        },
        "payload_load_ms": {
          "type": ["number", "null"],
          "minimum": 0,
          "description": "First payload load of a scenario, recorded on the first sample only; null when not measured."
        },
        "compile_ms": {
          "type": ["number", "null"],
          "minimum": 0,
          "description": "In-payload compile segment median; null when not measured."
        },
        "link_ms": {
          "type": ["number", "null"],
          "minimum": 0,
          "description": "Guest-local link segment median; null when not measured."
        },
        "offload_permille": { "type": ["integer", "null"], "minimum": 0, "maximum": 1000 },
        "retries": { "type": "integer", "minimum": 0 },
        "fallbacks": { "type": "integer", "minimum": 0 },
        "peak_kb": { "type": "integer", "minimum": 0 }
      }
    }
  }
}
